{
  "schema_version": 2,
  "required_open_questions": [
    {
      "id": "Q-001",
      "gates": ["architectural_promotion"],
      "locator": {
        "path": "docs/open-questions.md",
        "anchor": "1. What is the primary artifact?"
      }
    },
    {
      "id": "Q-015",
      "gates": ["stack_bakeoff"],
      "locator": {
        "path": "docs/open-questions.md",
        "anchor": "15. What belongs in the ontology versus the runtime?"
      }
    },
    {
      "id": "Q-018",
      "gates": ["stack_bakeoff"],
      "locator": {
        "path": "docs/open-questions.md",
        "anchor": "18. What is the right physical data model?"
      }
    },
    {
      "id": "Q-021",
      "gates": ["stack_bakeoff"],
      "locator": {
        "path": "docs/open-questions.md",
        "anchor": "21. Build from scratch or reuse existing software?"
      }
    },
    {
      "id": "Q-002",
      "gates": ["architectural_promotion"],
      "locator": {
        "path": "research/ops/decision-discipline/issue-0082-kinds-versus-verdicts.md",
        "anchor": "Q-002"
      }
    },
    {
      "id": "Q-071",
      "gates": ["stack_bakeoff", "architectural_promotion"],
      "locator": {
        "path": "docs/swarm-research-backlog.md",
        "anchor": "#71 first executable vertical and semantic acceptance suite"
      }
    }
  ],
  "criteria": [
    {
      "criterion_id": "EXP-01",
      "gate": "experiment",
      "title": "pergunta_limitada",
      "rules": [
        {
          "status": "pass",
          "when": {
            "all": [
              { "field_nonempty": "experiment_case.question" },
              { "min_resolved_refs": { "path": "experiment_case.question_refs", "count": 1 } }
            ]
          }
        },
        {
          "status": "fail",
          "when": { "not": { "field_nonempty": "experiment_case.question" } }
        },
        { "status": "undetermined", "default": true }
      ]
    },
    {
      "criterion_id": "EXP-02",
      "gate": "experiment",
      "title": "hipotese_e_falsificador",
      "rules": [
        {
          "status": "pass",
          "when": {
            "all": [
              { "field_nonempty": "experiment_case.hypothesis" },
              { "field_nonempty": "experiment_case.falsifier" },
              { "min_resolved_refs": { "path": "experiment_case.hypothesis_refs", "count": 1 } },
              { "min_resolved_refs": { "path": "experiment_case.falsifier_refs", "count": 1 } }
            ]
          }
        },
        {
          "status": "fail",
          "when": {
            "any": [
              { "not": { "field_nonempty": "experiment_case.hypothesis" } },
              { "not": { "field_nonempty": "experiment_case.falsifier" } }
            ]
          }
        },
        { "status": "undetermined", "default": true }
      ]
    },
    {
      "criterion_id": "EXP-03",
      "gate": "experiment",
      "title": "prova_executavel_discriminante",
      "rules": [
        {
          "status": "pass",
          "when": {
            "min_resolved_refs": {
              "path": "experiment_case.discriminating_proof_refs",
              "count": 1
            }
          }
        },
        { "status": "fail", "default": true }
      ]
    },
    {
      "criterion_id": "EXP-04",
      "gate": "experiment",
      "title": "fonte_ou_inferencia",
      "rules": [
        {
          "status": "pass",
          "when": { "field_nonempty": "experiment_case.source_kind" }
        },
        { "status": "fail", "default": true }
      ]
    },
    {
      "criterion_id": "EXP-05",
      "gate": "experiment",
      "title": "limites_declarados",
      "rules": [
        {
          "status": "pass",
          "when": {
            "all": [
              { "field_nonempty": "experiment_case.limits" },
              { "min_resolved_refs": { "path": "experiment_case.limits_refs", "count": 1 } }
            ]
          }
        },
        {
          "status": "fail",
          "when": { "not": { "field_nonempty": "experiment_case.limits" } }
        },
        { "status": "undetermined", "default": true }
      ]
    },
    {
      "criterion_id": "EXP-06",
      "gate": "experiment",
      "title": "ausencia_de_promocao_normativa",
      "rules": [
        {
          "status": "pass",
          "when": {
            "field_equals": {
              "path": "experiment_case.normative_promotion",
              "value": false
            }
          }
        },
        {
          "status": "fail",
          "when": {
            "field_equals": {
              "path": "experiment_case.normative_promotion",
              "value": true
            }
          }
        },
        { "status": "undetermined", "default": true }
      ]
    },
    {
      "criterion_id": "BAK-01",
      "gate": "stack_bakeoff",
      "title": "suite_implementation_neutral_publicada",
      "rules": [
        {
          "status": "pass",
          "when": {
            "all": [
              {
                "field_equals": {
                  "path": "stack_bakeoff_case.suite_published",
                  "value": true
                }
              },
              { "min_resolved_refs": { "path": "stack_bakeoff_case.suite_ref", "count": 1 } }
            ]
          }
        },
        {
          "status": "fail",
          "when": {
            "field_equals": {
              "path": "stack_bakeoff_case.suite_published",
              "value": false
            }
          }
        },
        { "status": "undetermined", "default": true }
      ]
    },
    {
      "criterion_id": "BAK-02",
      "gate": "stack_bakeoff",
      "title": "dois_candidatos_nas_mesmas_medidas",
      "rules": [
        {
          "status": "pass",
          "when": {
            "all": [
              {
                "min_distinct": {
                  "path": "stack_bakeoff_case.candidates",
                  "field": "candidate_id",
                  "count": 2
                }
              },
              {
                "each_item_resolved_refs": {
                  "path": "stack_bakeoff_case.candidates",
                  "field": "execution_refs",
                  "count": 1
                }
              },
              {
                "min_resolved_refs": {
                  "path": "stack_bakeoff_case.shared_measure_refs",
                  "count": 1
                }
              }
            ]
          }
        },
        {
          "status": "fail",
          "when": {
            "not": {
              "min_distinct": {
                "path": "stack_bakeoff_case.candidates",
                "field": "candidate_id",
                "count": 2
              }
            }
          }
        },
        { "status": "undetermined", "default": true }
      ]
    },
    {
      "criterion_id": "BAK-03",
      "gate": "stack_bakeoff",
      "title": "contratos_semanticos_suficientes",
      "rules": [
        {
          "status": "pass",
          "when": {
            "all": [
              {
                "field_equals": {
                  "path": "stack_bakeoff_case.suite_published",
                  "value": true
                }
              },
              {
                "min_resolved_refs": {
                  "path": "stack_bakeoff_case.semantic_contract_refs",
                  "count": 1
                }
              }
            ]
          }
        },
        {
          "status": "undetermined",
          "when": {
            "min_resolved_refs": {
              "path": "stack_bakeoff_case.semantic_contract_refs",
              "count": 1
            }
          }
        },
        { "status": "fail", "default": true }
      ]
    },
    {
      "criterion_id": "BAK-04",
      "gate": "stack_bakeoff",
      "title": "questoes_bloqueantes_limitadas",
      "rules": [
        {
          "status": "pass",
          "when": { "no_blocker": { "gate": "stack_bakeoff" } }
        },
        {
          "status": "fail",
          "when": { "not": { "no_blocker": { "gate": "stack_bakeoff" } } }
        },
        { "status": "undetermined", "default": true }
      ]
    },
    {
      "criterion_id": "BAK-05",
      "gate": "stack_bakeoff",
      "title": "ausencia_de_excecao_source_shaped",
      "rules": [
        {
          "status": "pass",
          "when": {
            "field_equals": {
              "path": "stack_bakeoff_case.source_shaped_exceptions",
              "value": false
            }
          }
        },
        {
          "status": "fail",
          "when": {
            "field_equals": {
              "path": "stack_bakeoff_case.source_shaped_exceptions",
              "value": true
            }
          }
        },
        { "status": "undetermined", "default": true }
      ]
    },
    {
      "criterion_id": "PRO-01",
      "gate": "architectural_promotion",
      "title": "evidencia_cross_domain",
      "rules": [
        {
          "status": "pass",
          "when": {
            "all": [
              {
                "field_equals": {
                  "path": "architectural_promotion_case.cross_domain_demonstrated",
                  "value": true
                }
              },
              {
                "min_resolved_refs": {
                  "path": "architectural_promotion_case.cross_domain_refs",
                  "count": 1
                }
              }
            ]
          }
        },
        {
          "status": "fail",
          "when": {
            "field_equals": {
              "path": "architectural_promotion_case.cross_domain_demonstrated",
              "value": false
            }
          }
        },
        { "status": "undetermined", "default": true }
      ]
    },
    {
      "criterion_id": "PRO-02",
      "gate": "architectural_promotion",
      "title": "evidencia_cross_industry",
      "rules": [
        {
          "status": "pass",